{
  "routing_id": "ROUTE-b0386374d137daa8",
  "intent_classification": "bug",
  "current_state": "REPAIR_REQUIRED",
  "task_type": "backend",
  "repair": true,
  "risk_flags": {},
  "project_profile": "personal",
  "requested_role": "agent-executor",
  "applicable_skills": [
    "agentic-systematic-debugging",
    "agentic-implementer"
  ],
  "required_skills": [
    "agentic-systematic-debugging",
    "agentic-implementer"
  ],
  "loaded_skills": [
    "agentic-systematic-debugging",
    "agentic-implementer"
  ],
  "routing_reason": "repair, failure, or defect signals require root-cause debugging; role agent-executor selects agentic-implementer",
  "routing_policy_version": "1"
}
